{
  "$schema": "https://json-schema.org/draft/2020-12/schema",
  "type": "object",
  "additionalProperties": false,
  "required": [
    "registry_id",
    "registry_version",
    "architecture_baseline_id",
    "status",
    "exceptions"
  ],
  "properties": {
    "registry_id": {
      "type": "string",
      "minLength": 1
    },
    "registry_version": {
      "type": "integer",
      "const": 1
    },
    "architecture_baseline_id": {
      "type": "string",
      "const": "AB-FR0-001"
    },
    "status": {
      "type": "string",
      "enum": [
        "DRAFT",
        "APPROVED"
      ]
    },
    "exceptions": {
      "type": "array",
      "items": {
        "type": "object",
        "additionalProperties": false,
        "required": [
          "exception_id",
          "status"
        ],
        "properties": {
          "exception_id": {
            "type": "string",
            "minLength": 1
          },
          "status": {
            "type": "string",
            "minLength": 1
          }
        }
      }
    },
    "non_waivable_controls": {
      "type": "array",
      "items": {
        "type": "string",
        "minLength": 1
      }
    }
  }
}
